Name,Notes,Address Short,City State Zip,Address Consolidated,Latitude,Longitude
Iglesia Misionera Jesucristo Es Dios,Friday 8am-11am,2801 Los Flores Blvd.,"Lynwood, CA 90262, United States","2801 Los Flores Blvd. Lynwood, CA 90262, United States",33.9329509,-118.2222436
Iglesia Pentecostal Peniel,Friday 10:30am-4pm,2614 Pasadena Ave,"Los Angeles, CA 90031, United States","2614 Pasadena Ave Los Angeles, CA 90031, United States",34.0770232,-118.2153932
"Iglesia Pentecostes El Lirio de Los Valles, Inc.",2nd & 4th Saturday 9am - 11 AM,"45029 N. Trevor Avenue, Suite #101","Lancaster, CA 93534, United States","45029 N. Trevor Avenue, Suite #101 Lancaster, CA 93534, United States",34.7012626,-118.1345052
Iglesia Pentecostes Roca de Salvacion,"Last Friday 8 am - 10:30 am ,  2nd & 4th Sunday 4:30pm-5:30pm",122 S. Evergreen Avenue,"Los Angeles, CA 90033, United States","122 S. Evergreen Avenue Los Angeles, CA 90033, United States",34.0396789,-118.202581
Iglesia Un Renuevo,3rd Friday 5:30pm - 8pm,13216 Fairford Ave.,"Norwalk, CA 90650, United States","13216 Fairford Ave. Norwalk, CA 90650, United States",33.9109543,-118.0945954
II Adam Ministries,"Thursday 10/02, 10/16, 10/30, 11/06, 11/20, 12/04, 12/18  5pm - 7pm",15849 E. Main St,"La Puente, CA 91744, United States","15849 E. Main St La Puente, CA 91744, United States",34.0203007,-117.9522903
Immanuel Presbyterian Church,Wednesday & Friday 9am - 12 PM,663 S. Berendo Street,"Los Angeles, CA 90005, United States","663 S. Berendo Street Los Angeles, CA 90005, United States",34.0610919,-118.2944153
Impact LA,1st and 3rd Friday 10:00 am - 2:00 PM,811 W. 7th Street Suite# 1236,"Los Angeles, CA 90017, United States","811 W. 7th Street Suite# 1236 Los Angeles, CA 90017, United States",34.0490854,-118.259013
Imperial Church of Christ,2nd & 4th Saturday 8am-9am,11316 S. San Pedro Street,"Los Angeles, CA 90061, United States","11316 S. San Pedro Street Los Angeles, CA 90061, United States",33.9315739,-118.269153
Indonesian American SDA Church,"1st,2nd, 3rd Tuseday 11:30am-1:00pm",803 W. First St,"Azusa, CA 91702, United States","803 W. First St Azusa, CA 91702, United States",34.1220226,-117.9167297
Inglewood Church of Christ,2nd Saturday 11am - 1 PM,323 S. Eucalyptus Ave.,"Inglewood, CA 90301, United States","323 S. Eucalyptus Ave. Inglewood, CA 90301, United States",33.9595298,-118.3598947
Inglewood Southside Christian Church,Saturday 10am - 1pm,3947 W. 104th Street,"Inglewood, CA 90303, United States","3947 W. 104th Street Inglewood, CA 90303, United States",33.9421127,-118.3433255
Inglewood Wrapping Arms Around the Community,2nd & 4th Sunday 9am-12pm,650 E Manchester Ave.,"Inglewood, CA 90301, United States","650 E Manchester Ave. Inglewood, CA 90301, United States",33.960159,-118.346893
Inglewood Wrapping Arms Around the Community / Masjid Bilal Islamic Center,Saturday 9am-12pm,4016 S. Central Ave,"Los Angeles, CA 90011, United States","4016 S. Central Ave Los Angeles, CA 90011, United States",34.0106632,-118.2557678
Inland Valley Hope Partners,Monday - Thursday  9 am - 2:30 pm,"209 W. Pearl Street, Suite J104 *knock on door","Pomona, CA 91766, United States","209 W. Pearl Street, Suite J104 *knock on door Pomona, CA 91766, United States",34.0649148,-117.7524328
Inland Valley Hope Partners,Tuesday 9 am - 4 pm,660 N. Mountain Avenue,"Claremont, CA 91711, United States","660 N. Mountain Avenue Claremont, CA 91711, United States",34.0998744,-117.7281741
Inland Valley Hope Partners,"Monday, Wednesday, Friday  2 pm - 4 pm",110 E. 3rd Street,"San Dimas, CA 91773, United States","110 E. 3rd Street San Dimas, CA 91773, United States",34.1096106,-117.8066779
Inland Valley Hope Partners,Monday - Thursday  9 am - 3 pm,904 E. California Street,"Ontario, CA 91761, United States","904 E. California Street Ontario, CA 91761, United States",34.0555515,-117.6363812
Inner City Child Development &Youth Foundation,Thurdsay 11am- 1pm,8928 Figueroa St,"Los Angeles, CA 90003, United States","8928 Figueroa St Los Angeles, CA 90003, United States",33.9553598,-118.2824677
Interfaith Food Center,"Monday, Tuesday & Friday  8:30 am -10 am , 10:30 am - 12 pm & Tuesday 4:30 pm - 6:30 pm",11819 Burke Street,"Santa Fe Springs, CA 90670, United States","11819 Burke Street Santa Fe Springs, CA 90670, United States",33.9629368,-118.0650538
International Families Association,Monday 12pm-4pm,240 S. Glendale Ave,"Glendale, CA 91205, United States","240 S. Glendale Ave Glendale, CA 91205, United States",34.143183,-118.2483963
Islah L.A.,Saturday 10am-2pm,2900 Slauson Ave.,"Los Angeles, CA 90043, United States","2900 Slauson Ave. Los Angeles, CA 90043, United States",33.9888533,-118.3246887
Islamic Center of Southern CA - Hope Net,Saturday 9:30 am - 11 am,434 S. Vermont Boulevard,"Los Angeles, CA 90020, United States","434 S. Vermont Boulevard Los Angeles, CA 90020, United States",34.0665598,-118.2916754
IVCINYA Foundation,"Thursday 10/02, 10/16, 10/30, 11/13, 11/27, 12/11, 12/25  9am-1pm",8928 Figueroa St,"Los Angeles, CA 90003, United States","8928 Figueroa St Los Angeles, CA 90003, United States",33.9553598,-118.2824677
Jeremiah 1:10 Corporation,Thursday 10am - 11 am,10896 Lehigh Ave,"Pacoima, CA 91331, United States","10896 Lehigh Ave Pacoima, CA 91331, United States",34.2687979,-118.4153519
Jesucristo el Mana,Wednesday 5:30pm-6:30pm,12838 Atlantic Ave,"Compton, CA 90221, United States","12838 Atlantic Ave Compton, CA 90221, United States",33.9050543,-118.1937958
Jesus House Palmdale,2nd & 4th Monday 12pm - 2pm,313 E. Palmdale Blvd,"Units A,  B, Palmdale, CA 93590, United States","313 E. Palmdale Blvd Units A,  B, Palmdale, CA 93590, United States",34.580373,-118.1243146
JFS/SOVA Community Food & Resource Program,Monday-Thursday 10am-1:30pm & Sundays 9am-12pm,8846 W. Pico Boulevard,"Los Angeles, CA 90035, United States","8846 W. Pico Boulevard Los Angeles, CA 90035, United States",34.0547865,-118.3848465
JFS/SOVA Community Food & Resource Program,1st & 3rd Friday 9am-11am,801 N. Kings Road,"West Hollywood, CA 90069, United States","801 N. Kings Road West Hollywood, CA 90069, United States",34.0856463,-118.3721303
JFS/SOVA Community Food & Resource Program,Tuesday 10am-12pm,7377 Santa Monica Blvd,"Los Angeles, CA 90046, United States","7377 Santa Monica Blvd Los Angeles, CA 90046, United States",34.0927831,-118.3511258
JFS/SOVA Community Food & Resource Program,"Monday- Wednesday 10 am - 2:30 pm, Sunday 9am - 12 pm",16439 Vanowen Street,"Van Nuys, CA 91406, United States","16439 Vanowen Street Van Nuys, CA 91406, United States",34.1946798,-118.4917628
Joseph Jacob United Church of God In Christ Inc,2nd Wednesday 10am-11:30am,16303 Orange Ave,"Paramount, CA 90723, United States","16303 Orange Ave Paramount, CA 90723, United States",33.8863024,-118.1778124
Journey of Love,1st Tuesday 6pm - 7:30pm,423 S San Pedro,"Los Angeles, CA 90013, United States","423 S San Pedro Los Angeles, CA 90013, United States",34.045339,-118.2436626
Journey of Love,"Last Friday 8 am - 10 am  OPEN 11/26, CLOSED 11/28",20320 Norwalk Blvd,"Lakewood, CA 90715, United States","20320 Norwalk Blvd Lakewood, CA 90715, United States",33.8455214,-118.0716868
Journey of Love,2nd Friday 8am-10am,12005 Garfield Ave,"South Gate, CA 90302, United States","12005 Garfield Ave South Gate, CA 90302, United States",33.9177192,-118.1693152
Justice for Murdered Children,"2nd, 3rd & 4th Saturday 1pm - 3pm",1039 Elberon Ave,"San Pedro, CA 90732, United States","1039 Elberon Ave San Pedro, CA 90732, United States",33.7481948,-118.299846
Karsh Family Social Service Center,"Tuesday 12:00 pm - 2:00 pm, Sundays 8:00 am - 9:30 am",3750 W. 6th Street,"Los Angeles, CA 90020, United States","3750 W. 6th Street Los Angeles, CA 90020, United States",34.0632632,-118.3044586
Kedren Community Health Center,2nd & 4th Friday 9am-11am,4211 S. Avalon Blvd,"Los Angeles, CA 90011, United States","4211 S. Avalon Blvd Los Angeles, CA 90011, United States",34.0072756,-118.2652643
Khalsa Care Foundation,Friday 4:30 pm - 6:30 pm,9989 Laurel Canyon Blvd.,"Pacoima, CA 91331, United States","9989 Laurel Canyon Blvd. Pacoima, CA 91331, United States",34.2512842,-118.4255414
Kingdom Family Network,2nd Wednesday 7pm-8pm & 4th  Saturday 9am-10am,646 S. San Antonio,"Pomona, CA 91766, United States","646 S. San Antonio Pomona, CA 91766, United States",34.0539779,-117.7362785
Korean Church of North L.A.,"1st, 3rd Saturday 9 - 10 am",8756 Woodley Ave,"North Hills, CA 91343, United States","8756 Woodley Ave North Hills, CA 91343, United States",34.2296992,-118.4848452
Koreatown Youth Community Center Inc.,3rd Friday 10 am - 11 am,1230 S. Menlo Ave #100,"Los Angeles, CA 90006, United States","1230 S. Menlo Ave #100 Los Angeles, CA 90006, United States",34.0478768,-118.2903692
La Habra Christian Church,"1st Saturday 8am - 11am, Sundays 11am-12pm",1400 Bella Vista Drive,"La Habra Heights, CA 90631, United States","1400 Bella Vista Drive La Habra Heights, CA 90631, United States",33.9500936,-117.9272674
LA Promise Fund,1st & 3rd Wednesdays 2:30pm-4pm,2340 Firestone Blvd,"South Gate, CA 90280, United States","2340 Firestone Blvd South Gate, CA 90280, United States",33.9563812,-118.2297576
La Puente Church of Christ,1st & 3rd Friday 7:30am-9:30am,15124 E. Amar Road,"La Puente, CA 91744, United States","15124 E. Amar Road La Puente, CA 91744, United States",34.0361286,-117.9346042
La Puente Foursquare Church,"Tuesday, Thursday & Saturday 10:30am-11:15am & Sunday 11:45am-12:30pm",15017 Fairgrove Ave.,"La Puente, CA 91744, United States","15017 Fairgrove Ave. La Puente, CA 91744, United States",34.0454903,-117.9536397
La Puente Spanish S.D.A. Church,2nd & 4th Wednesday 10am-11am & 7:30pm-8:30pm 2nd & 4th Saturday 12pm-1pm,18047 Valley Boulevard,"La Puente, CA 91744, United States","18047 Valley Boulevard La Puente, CA 91744, United States",34.0068113,-117.9088349
LA Valley College,Wednesday 11am-1pm,5800 Fulton Ave,"Valley Glem, CA 91401, United States","5800 Fulton Ave Valley Glem, CA 91401, United States",34.1752206,-118.4151579
La Voz Sylmar SDA Church,Thursday 4:30 pm - 5:30 pm,13550 Herron St,"Sylmar, CA 91342, United States","13550 Herron St Sylmar, CA 91342, United States",34.3135517,-118.4278215
Lady Bug Ministry,Last Tuesday 9am - 10am,1016 E Rosecrans Ave,"Compton, CA 90043, United States","1016 E Rosecrans Ave Compton, CA 90043, United States",33.9022549,-118.2571439
Lady Bug Ministry,1st Wednesday 9am-10am,6111 Gramercy Place,"Los Angeles, CA 90047, United States","6111 Gramercy Place Los Angeles, CA 90047, United States",33.984096,-118.3139205
Lakeview Terrace American Baptist Church,2nd Saturday 10am - 1130,11901 Foothill Blvd,"Sylmar, CA 91342, United States","11901 Foothill Blvd Sylmar, CA 91342, United States",34.275728,-118.3958612
Lancaster Municipal Stadium,11/22/2025 | 9am - 12pm,45116 Vly Central Way,"Lancaster, CA 93536, United States","45116 Vly Central Way Lancaster, CA 93536, United States",34.7028501,-118.1729732
Lawrence Ministries,3rd Saturdays 10 am - 2 pm,12441 E. Farlow Street,"Hawaiian Gardens, CA 90716, United States","12441 E. Farlow Street Hawaiian Gardens, CA 90716, United States",33.8328834,-118.0662692
LBCC @Veterans Memorial Stadium,11/21/2025 | 9am -12pm,5000 E. Lew Davis Street LOT M,"Long Beach, CA 90808, United States","5000 E. Lew Davis Street LOT M Long Beach, CA 90808, United States",33.8276307,-118.1361964
LCS Maywood,4th Tuesday 9am-12pm,4735 Slauson Ave,"Maywood, CA 90270, United States","4735 Slauson Ave Maywood, CA 90270, United States",33.9868861,-118.1799236
LCS Mission Hills,2nd Tuesday  9am-12pm,14800 Devonshire St,"Mission Hills, CA 91345, United States","14800 Devonshire St Mission Hills, CA 91345, United States",34.2569199,-118.4547255
Lennox Middle School,11/22/2025 | 9am - 12pm,11033 Buford Avenue,"Lennox, CA 90304, United States","11033 Buford Avenue Lennox, CA 90304, United States",33.9346693,-118.3644569
Light and Life Free Methodist Church,Wedensday 10am-12pm & 2nd Saturday 10am - 12pm,5951 Downey Ave,"Long Beach, CA 90805, United States","5951 Downey Ave Long Beach, CA 90805, United States",33.8636561,-118.1520395
Lighthouse Community Outreach Inc,Thursdays 11 am - 3 pm,1976 E. 103rd St,"Los Angeles, CA 90002, United States","1976 E. 103rd St Los Angeles, CA 90002, United States",33.9428449,-118.2370796
Lighthouse of San Fernando,Friday 3pm - 4pm,622 N. Maclay Ave,"San Fernando, CA 91340, United States","622 N. Maclay Ave San Fernando, CA 91340, United States",34.2891819,-118.4328024
Lincoln Avenue Baptist Church,Wednesday 10am - 12pm,1180 N. Lincoln Avenue,"Pasadena, CA 91103, United States","1180 N. Lincoln Avenue Pasadena, CA 91103, United States",34.1816336,-118.1596911
Living Hope SDA Church,3rd & 4th Sunday 1pm-3pm,650 W. 21st St,"Los Angeles, CA 90007, United States","650 W. 21st St Los Angeles, CA 90007, United States",34.0326766,-118.2751824
Living Springs Foursquare Church,2nd & 4th Wednesday 8am - 10am,17315 Coolwater Ave,"Palmdale, CA 93591, United States","17315 Coolwater Ave Palmdale, CA 93591, United States",34.6158829,-117.8202224
Loaves & Fishes - Canoga Park,"4th Mondays, Wednesdays & Fridays 9 am - 12 pm",21600 Hart Street,"Canoga Park, CA 91303, United States","21600 Hart Street Canoga Park, CA 91303, United States",34.1972021,-118.6006611
Loaves & Fishes - Glendale,Monday- Friday 9am-3pm,4322 San Fernando Road,"Glendale, CA 91204, United States","4322 San Fernando Road Glendale, CA 91204, United States",34.1316301,-118.2610603
Long Beach Center for Economic Inclusion,Mondays 10am-12pm,6509 Gundry Ave,"Long Beach, CA 90805, United States","6509 Gundry Ave Long Beach, CA 90805, United States",33.8730083,-118.1754622
Long Beach City College,Monday - Thursday 9am-4pm,4901 E. Carson St,"Long Beach, CA 90808, United States","4901 E. Carson St Long Beach, CA 90808, United States",33.829762,-118.1358352
Long Beach City College - MFP,4th Thursday 1pm - 3pm,1305 E Pacific Coast Hwy,"Long Beach, CA 90806, United States","1305 E Pacific Coast Hwy Long Beach, CA 90806, United States",33.7919745,-118.1760191
Long Beach City College- PCC Campus,4th Tuesday 1pm-3pm,1305 E. Pacific Coast Hwy,"Long Beach, CA 90806, United States","1305 E. Pacific Coast Hwy Long Beach, CA 90806, United States",33.7919745,-118.1760191
Long Beach Community Table,"Tuesday's & Wednesday's 5:30pm-7pm , Fridays's 12pm-4pm & Saturday's 12pm-2pm",3311 E. 59th St,"Long Beach, CA 90805, United States","3311 E. 59th St Long Beach, CA 90805, United States",33.8632054,-118.1527727
Long Beach Family Health Care Outreach Inc.,"Friday 10/3, 10/17, 11/7, 11/21, 12/5, 12/19 10am-12pm",2385 Pacific Ave,"Long Beach, CA 90806, United States","2385 Pacific Ave Long Beach, CA 90806, United States",33.8005541,-118.1940414
Long Beach Lutheran Social Services,"Monday, Tuesday 10am - 12pm, 1230pm - 2pm, Wednesday 11am - 12pm, 1230 - 2pm, Thursday 10am - 12pm, 1230 - 2pm",1611 Pine Avenue,"Long Beach, CA 90813, United States","1611 Pine Avenue Long Beach, CA 90813, United States",33.7874645,-118.1927444
Long Beach Poly High School Food Bank,Wednesday & Friday 2pm-4pm,1600 Atlantic Ave,"Long Beach, CA 90813, United States","1600 Atlantic Ave Long Beach, CA 90813, United States",33.7871324,-118.183218
Long Beach S.D.A. Church,3rd Sunday 8am-10am,1001 E. 3rd Street,"Long Beach, CA 90802, United States","1001 E. 3rd Street Long Beach, CA 90802, United States",33.7709249,-118.1797899
Los Angeles Boys & Girls Club,Thursday 4pm - 6pm & Sunday 11am-1pm,2635 Pasadena Avenue,"Los Angeles, CA 90031, United States","2635 Pasadena Avenue Los Angeles, CA 90031, United States",34.078001,-118.215701
Los Angeles County Aging and Disabilities Depart.,"Monday 2 pm - 4 pm, & Tuesday 930am - 12pm &  2 pm - 4 pm",1441 Santa Anita Avenue,"South El Monte, CA 91733, United States","1441 Santa Anita Avenue South El Monte, CA 91733, United States",34.0451558,-118.04555
Los Angeles County Aging and Disabilities Depart.,"Monday 2pm - 4pm, Tuesday 930am - 12pm, 2pm - 4pm",15116 S. Atlantic Ave,"Compton, CA 90221, United States","15116 S. Atlantic Ave Compton, CA 90221, United States",33.8954999,-118.1926859
Los Angeles County Aging and Disabilities Depart.,Monday 2pm - 4PM & Tuesday 9:30am - 12 PM & 2pm-4pm,4716 E. Cesar Chavez Avenue,"Los Angeles, CA 90022, United States","4716 E. Cesar Chavez Avenue Los Angeles, CA 90022, United States",34.0403431,-118.1644806
Los Angeles County Aging and Disabilities Depart.,Monday 2pm - 4PM & Tuesday 9:30am - 12 PM & 2pm-4PM,133 N. Sunol Drive,"Los Angeles, CA 90063, United States","133 N. Sunol Drive Los Angeles, CA 90063, United States",34.037144,-118.1793032
Los Angeles County Aging and Disabilities Depart.,"Monday 2pm - 4pm, Tuesday 9:30am - 12pm, 2pm - 4pm",777 W. Jackman Street,"Lancaster, CA 93534, United States","777 W. Jackman Street Lancaster, CA 93534, United States",34.7016605,-118.1447615
Los Angeles County Aging and Disabilities Depart.,Monday 2pm-4pm & Tuesday 9:30am-12pm & 2pm-4pm,11640 W. Slauson Avenue,"Whittier, CA 90606, United States","11640 W. Slauson Avenue Whittier, CA 90606, United States",33.9642626,-118.0676184
Los Angeles County Aging and Disabilities Depart.,"Monday 2pm - 4pm, Tuesday 930am - 12pm, 2pm - 4pm",12915 Jarvis Avenue,"Los Angeles, CA 90061, United States","12915 Jarvis Avenue Los Angeles, CA 90061, United States",33.9149413,-118.2723456
Los Angeles County Aging and Disabilities Depart.,"Monday 2pm - 4pm, Tuesday 930am - 12pm, 2pm - 4pm",769 W. Third Street,"San Pedro, CA 90731, United States","769 W. Third Street San Pedro, CA 90731, United States",33.7413313,-118.2939075
Los Angeles County Aging and Disabilities Depart.,"Monday 2pm - 530pm, Tuesday 930am - 12pm, 2pm - 530pm",7807 S. Compton Avenue,"Los Angeles, CA 90001, United States","7807 S. Compton Avenue Los Angeles, CA 90001, United States",33.9197623,-118.2465216
Los Angeles County Aging and Disabilities Depart.,"Monday 2pm - 4pm, Tuesday 930am - 12pm, 2pm - 4pm","26111 Bouquet Canyon Road, Suite H001","Santa Clarita, CA 91350, United States","26111 Bouquet Canyon Road, Suite H001 Santa Clarita, CA 91350, United States",34.4178581,-118.5427721
Los Angeles County Aging and Disabilities Depart.,"Monday 2pm - 4pm, Tuesday 9:30am - 12pm, 2pm - 4pm",441 E. Carson St. Ste. L,"Carson, CA 90745, United States","441 E. Carson St. Ste. L Carson, CA 90745, United States",33.8324786,-118.2686794
Los Angeles County/USC Medical Center Auxiliary,4th Friday 9am-11am    November & December Distributions will be held the 2nd Friday 11/14 & 12/12,1200 N. State Street,"Los Angeles, CA 90033, United States","1200 N. State Street Los Angeles, CA 90033, United States",34.0600972,-118.2117685
Los Angeles First Church of the Nazarene - Hope Net,Saturday 8 - 10am,3401 W. 3rd Street,"Los Angeles, CA 90020, United States","3401 W. 3rd Street Los Angeles, CA 90020, United States",34.0692656,-118.2896795
Love & Unity Christian Fellowship,3rd Friday 12pm - 2pm,1842 S. Wilmington Ave,"Compton, CA 90220, United States","1842 S. Wilmington Ave Compton, CA 90220, United States",33.8769065,-118.2357327
Loveship Community Outreach,2nd Sundays 9:30 am - 11:30 am & 4th Saturday 2:30pm-4:30pm,836 E. Avenue I,"Lancaster, CA 93535, United States","836 E. Avenue I Lancaster, CA 93535, United States",34.7038308,-118.1136341
Lutheran Social Services of SoCal,Monday-Thursday 8am-2pm,1611 Pine Ave,"Long Beach, CA 90813, United States","1611 Pine Ave Long Beach, CA 90813, United States",33.7874645,-118.1927444
Lynwood Partners Educational Foundation,Wednesdays 10 am - 12:30 pm,11321 Bullis Rd,"Lynwood, CA 90262, United States","11321 Bullis Rd Lynwood, CA 90262, United States",33.9262361,-118.2003727
Lynwood United Methodist Church,Wednesdays 9 am - 10 am,4207 Carlin Avenue,"Lynwood, CA 90262, United States","4207 Carlin Avenue Lynwood, CA 90262, United States",33.9125476,-118.1961475
Macedonia Community Development,Tuesdays 9am-11am,11101 Wilmington Ave.,"Los Angeles, CA 90059, United States","11101 Wilmington Ave. Los Angeles, CA 90059, United States",33.934187,-118.2392539
Making It Happen,Saturday 1:30pm-2:30pm,9666 Foothill Pl,"Lakeview Terrace, CA 91342, United States","9666 Foothill Pl Lakeview Terrace, CA 91342, United States",34.2733214,-118.3402136
Manos Que Sobreviven,Wednesday 7am - 2pm,2930 Fletcher Dr,"Los Angeles, CA 90065, United States","2930 Fletcher Dr Los Angeles, CA 90065, United States",34.1139119,-118.2466544
Maranatha S.D.A. Community Center,"2nd, 4th Tuesday 10am - 1130am",3569 W. Manchester Blvd,"Inglewood, CA 90305, United States","3569 W. Manchester Blvd Inglewood, CA 90305, United States",33.9602163,-118.3348263
Meet Each Need with Dignity,"1st & 3rdTuesday 10am-11am, Wednesday & Friday 9am-12pm, Thursday 9am-11am & 1st & 3rd Saturday 9am-12pm",10641 San Fernando Rd,"Pacoima, CA 91331, United States","10641 San Fernando Rd Pacoima, CA 91331, United States",34.2630367,-118.4195743
Men's Health Foundation,2nd & 4th Wednesday 12pm-2pm & 4pm-6pm,8601 S. Broadway St,"Los Angeles, CA 90003, United States","8601 S. Broadway St Los Angeles, CA 90003, United States",33.9598853,-118.2788032
Metropolitan Community Church of L.A.,Saturday 7:30am - 9:30am,4607 Prospect Avenue,"Los Angeles, CA 90027, United States","4607 Prospect Avenue Los Angeles, CA 90027, United States",34.1020959,-118.2898258
Mexican - American Opportunity Foundation,Thursday 8am - 12pm,401 N. Garfield Ave,"Montebello, CA 90640, United States","401 N. Garfield Ave Montebello, CA 90640, United States",34.0192276,-118.1337198
Mid City Spanish S.D.A. Church,"Wednesday 12:pm -3pm 10/01, 10/15, 10/29, 11/12, 11/26, 12/10",330 W. 61st St,"Los Angeles, CA 90003, United States","330 W. 61st St Los Angeles, CA 90003, United States",33.9838901,-118.2794877
Mid Valley Family,3rd Thursday 330 - 430pm,6901 Lennox Ave.,"Van Nuys, CA 91405, United States","6901 Lennox Ave. Van Nuys, CA 91405, United States",34.1966127,-118.4456648
Ministerio Cristiano Faro de Luz,Thursdays 9am-12pm,7502 San Pedro St,"Los Angeles, CA 90003, United States","7502 San Pedro St Los Angeles, CA 90003, United States",33.9720187,-118.2692302
Ministerio Cristiano Faro de Luz,Wednesday 9am-12pm,9615 Kalmia St,"Los Angeles, CA 90002, United States","9615 Kalmia St Los Angeles, CA 90002, United States",33.9489571,-118.2320065
Ministry by Insprirational Women,Tuesdays 12pm-2pm,3740 E. Imperial Hwy,"Lynwood, CA 90262, United States","3740 E. Imperial Hwy Lynwood, CA 90262, United States",33.9317893,-118.1979643
Mission Church of the Hour,Wednesday 6:30am-11am,3611 S. Western Ave,"Los Angeles, CA 90018, United States","3611 S. Western Ave Los Angeles, CA 90018, United States",34.0225056,-118.3091544
Mission Siloe Defensores de la fe Cristian,Tuesday 2pm - 4pm,3818 Maple Ave,"Los Angeles, CA 90011, United States","3818 Maple Ave Los Angeles, CA 90011, United States",34.0125672,-118.272082
Missionaries of Charity,Friday 300pm - 500pm,10950 California Avenue,"Lynwood, CA 90262, United States","10950 California Avenue Lynwood, CA 90262, United States",33.9334774,-118.2081459
Morning Star Outreach Ministry,"2nd Sat 11am-1pm, 4th Saturday 11am-12pm",1416 N. Mentor Ave,"Pasadena, CA 91104, United States","1416 N. Mentor Ave Pasadena, CA 91104, United States",34.1702288,-118.1307582
Morningstar Christian Chapel,Tuesday 10:30 am - 11:30 am,16241 Leffingwell Road,"Whittier, CA 90603, United States","16241 Leffingwell Road Whittier, CA 90603, United States",33.9328701,-117.9843219
"Mothers In Action, Inc.",3rd Tuesday 12pm-3pm,3800 S. Crenshaw Blvd.,"Los Angeles, CA 90008, United States","3800 S. Crenshaw Blvd. Los Angeles, CA 90008, United States",34.0174912,-118.3350497
Mount Hebron Baptist Church,Wednesday 10:30am-1pm,10219 S. Western Ave,"Los Angeles, CA 90047, United States","10219 S. Western Ave Los Angeles, CA 90047, United States",33.9434979,-118.3093247
Mountain of Solutions,2nd and 4th Saturday 12pm-2pm,849 West 85th St,"Los Angeles, CA 90044, United States","849 West 85th St Los Angeles, CA 90044, United States",33.9614401,-118.2886529
Mountain View School District,"Thursday10/2, 10/16, 10/30, 11/13, 11/24, 12/4, 12/18  2pm-6pm",2740 Mt. View Road,"El Monte, CA 91732, United States","2740 Mt. View Road El Monte, CA 91732, United States",34.0602384,-118.0239164
Mrs. Sues House,3rd Monday 10am-12:30pm,345 E. 51st St,"Los Angeles, CA 90011, United States","345 E. 51st St Los Angeles, CA 90011, United States",33.9975563,-118.2665493
My Friends House Foundation,Wednesday 8 am - 10 am,3533 W. 58th Place,"Los Angeles, CA 90043, United States","3533 W. 58th Place Los Angeles, CA 90043, United States",33.9883366,-118.3341769
My Friends House Foundation,Tuesday 3pm - 6pm,1244 E. 7th Street,"Los Angeles, CA 90021, United States","1244 E. 7th Street Los Angeles, CA 90021, United States",34.0367842,-118.2415404
National Day Laborer Organizing Network,Friday 8 am - 12 pm,500 N. Lake,"Pasadena, CA 91101, United States","500 N. Lake Pasadena, CA 91101, United States",34.1546654,-118.1321539
New Antioch Church of God,4th Saturday 8:30am-10am,7826 S. Vermont Ave,"Los Angeles, CA 90044, United States","7826 S. Vermont Ave Los Angeles, CA 90044, United States",33.9683224,-118.2914386
New Beginings Outreach CDC,Mondays 10am-3pm,1000 W. Artesia Blvd,"Gardena, CA 90248, United States","1000 W. Artesia Blvd Gardena, CA 90248, United States",33.8721995,-118.2923092
New Hope Tenth St Baptist Church,4th Saturday 10am-12pm,1160 E. New York Street,"Long Beach, CA 90813, United States","1160 E. New York Street Long Beach, CA 90813, United States",33.784623,-118.1777775
New Life Community Church,Thursday 4:30pm-5:30pm & Friday 11am-3pm CLOSED every 1st week of the month,275 E. Foothill Boulevard,"Pomona, CA 91767, United States","275 E. Foothill Boulevard Pomona, CA 91767, United States",34.1080129,-117.7448828
New Life Community Church,Saturday 9:30am-10:30am,18800 Norwalk Blvd,"Artesia, CA 90701, United States","18800 Norwalk Blvd Artesia, CA 90701, United States",33.8614471,-118.071664
