Name,Notes,Address Short,City State Zip,Address Consolidated,Latitude,Longitude
East L.A. Bilingual S.D.A. Church,Wednesday 2 - 4pm,700 Hoefner Avenue,"Los Angeles, CA 90022, United States","700 Hoefner Avenue Los Angeles, CA 90022, United States",34.0209416,-118.1494151
East LA Community Corporation,3rd Tuesday 9am-11am,611 South Lorena St.,"Los Angeles, CA 90023, United States","611 South Lorena St. Los Angeles, CA 90023, United States",34.031107,-118.1999823
Eastmont Community Center,Tuesday 8:30 AM - 10 AM,701 Hoefner Avenue,"Los Angeles, CA 90022, United States","701 Hoefner Avenue Los Angeles, CA 90022, United States",34.0210131,-118.1501655
Eastmont S.D.A. Spanish Church,Monday 6:00pm - 7:30pm,1021 Westside Drive,"Los Angeles, CA 90022, United States","1021 Westside Drive Los Angeles, CA 90022, United States",34.0137182,-118.1376601
Education & Economic Development Community Center,3rd Saturday 11am-2pm,8204 S. Avalon Blvd,"Los Angeles, CA 90003, United States","8204 S. Avalon Blvd Los Angeles, CA 90003, United States",33.9645348,-118.2648592
El Camino Community College District Foundation,Tuesday 12pm-5pm Wednesday & Thursday 10am-3pm,16007 Crenshaw Blvd.,"Torrance, CA 90506, United States","16007 Crenshaw Blvd. Torrance, CA 90506, United States",33.8835254,-118.3321158
El Hajj Malik Shabazz Islamic Center,2nd & 4th Friday 2pm-3:30pm,2914 W. Jefferson Blvd,"Los Angeles, CA 90018, United States","2914 W. Jefferson Blvd Los Angeles, CA 90018, United States",34.0254205,-118.3277412
El Monte Wesleyan Christian Church,"1st & 3rd Tuesday 11am- 12:30pm, 11/4  2 pm - 3 pm",2400 Santa Anita Avenue,"South El Monte, CA 91733, United States","2400 Santa Anita Avenue South El Monte, CA 91733, United States",34.0562594,-118.0420711
El Monte/South El Monte Emergency Resource Association,Monday - Friday 11:30 am - 1 pm,10900 Mulhall Street,"South El Monte, CA 91731, United States","10900 Mulhall Street South El Monte, CA 91731, United States",34.0887718,-118.0297671
El Santo Nino Community Center,2nd & 4th Wednesday 1pm-2:30pm,601 E. 23rd St,"Los Angeles, CA 90011, United States","601 E. 23rd St Los Angeles, CA 90011, United States",34.0251492,-118.2614856
El Sereno Spanish S.D.A. Church,Sundays 8am-10am,3304 N Eastern Ave,"Los Angeles, CA 90032, United States","3304 N Eastern Ave Los Angeles, CA 90032, United States",34.0836448,-118.1777287
Eliza Shanks Homes. Inc.,Monday - Friday 9am - 5pm,13055 Weidner Street,"Pacoima, CA 91331, United States","13055 Weidner Street Pacoima, CA 91331, United States",34.2772231,-118.4174074
Emmanuel Covenant Church of Northridge,Tuesday 11:30am-1pm & Friday 12pm-2pm,17645 Saticoy St,"Northridge, CA 91325, United States","17645 Saticoy St Northridge, CA 91325, United States",34.2088163,-118.5180987
Encounter Community Church,2nd Wednesday 9am - 11am,18749 Crenshaw Boulevard,"Torrance, CA 90504, United States","18749 Crenshaw Boulevard Torrance, CA 90504, United States",33.8600152,-118.3273172
Ephesus S.D.A. Church,"Wednesday 10am - 11 am  &  4th Thursday 11am - 2pm  OPEN November 20 CLOSED November 27, OPEN December 11 CLOSED December 25",7005 S. Western Avenue,"Los Angeles, CA 90047, United States","7005 S. Western Avenue Los Angeles, CA 90047, United States",33.9759737,-118.3092595
Esmirna Pentecostal Church,Friday 10am-1pm,5414 N. Figueroa Street,"Los Angeles, CA 90042, United States","5414 N. Figueroa Street Los Angeles, CA 90042, United States",34.1072122,-118.196612
Estrella Del Mar de L.A. (Regis House CoMun,2nd and 4th Wednesday 10am - 11am,2212 Beverly Boulevard,"Los Angeles, CA 90057, United States","2212 Beverly Boulevard Los Angeles, CA 90057, United States",34.0670916,-118.271985
Faith Baptist Fellowship of Long Beach,2nd Saturday 10am - 1pm,2155 Atlantic Avenue,"Long Beach, CA 90806, United States","2155 Atlantic Avenue Long Beach, CA 90806, United States",33.7963304,-118.1853353
Faithful Walk Ministries,3rd Saturday 11am-1pm,6125  S. San Pedro Street,"Los Angeles, CA 90003, United States","6125  S. San Pedro Street Los Angeles, CA 90003, United States",33.9835,-118.269861
Family Health Care Centers of Greater Los Angeles,3rd Wednesday 9 am- 11 am,6501 S. Garfield Ave,"Bell Gardens, CA 90201, United States","6501 S. Garfield Ave Bell Gardens, CA 90201, United States",33.9729696,-118.1478791
Family Health Care Resources,Friday 9 am - 3 pm,3444 Whitter Blvd.,"Los Angeles, CA 90023, United States","3444 Whitter Blvd. Los Angeles, CA 90023, United States",34.0269402,-118.199737
Family Life Center Apostolic Church,Thursday 9am - 11am,7435 Norwalk Blvd.,"Whittier, CA 90606, United States","7435 Norwalk Blvd. Whittier, CA 90606, United States",33.9787859,-118.0768676
Family Mennonite Church,2nd Saturday 9am - 11am,6520 S. Normandie Avenue,"Los Angeles, CA 90044, United States","6520 S. Normandie Avenue Los Angeles, CA 90044, United States",33.9799791,-118.2999374
Feed My Sheep Christian Fellowship,2nd and 4th Friday 10am-1pm,1305 E. Compton Blvd,"Compton, CA 90221, United States","1305 E. Compton Blvd Compton, CA 90221, United States",33.8961999,-118.2092442
Fifty-fourth Street S.D.A. Church,2nd & 4th Saturday 2:30pm-3:30pm,1973 West 54th Street,"Los Angeles, CA 90062, United States","1973 West 54th Street Los Angeles, CA 90062, United States",33.993557,-118.313484
Figueroa Church of Christ,Tuesday & Thursday 7:30am - 9 am,455 W. 57th St.,"Los Angeles, CA 90037, United States","455 W. 57th St. Los Angeles, CA 90037, United States",33.9908584,-118.282171
Filipino Christian Church,2nd & 4th Saturday 10am - 11am,301 N. Union Avenue,"Los Angeles, CA 90026, United States","301 N. Union Avenue Los Angeles, CA 90026, United States",34.067609,-118.264533
Finger of God Goodnews Ministry,2nd & 4th Saturday 10AM - 12 PM,21919 S. Figueroa Street,"Carson, CA 90745, United States","21919 S. Figueroa Street Carson, CA 90745, United States",33.8283762,-118.286487
First African Methodist Episcopal Church,4th Saturday 9am - 12pm,2270 S. Harvard Boulevard,"Los Angeles, CA 90018, United States","2270 S. Harvard Boulevard Los Angeles, CA 90018, United States",34.0344884,-118.3063515
First Baptist Church of Alhambra,"2nd , 4th Thursday 11 am - 12 pm",101 S. Atlantic Blvd.,"Alhambra, CA 91801, United States","101 S. Atlantic Blvd. Alhambra, CA 91801, United States",34.0898709,-118.1352798
First Christian Church Wilmington,4th Saturday 9am-10am,444 E. Lomita Blvd,"Wilmington, CA 90744, United States","444 E. Lomita Blvd Wilmington, CA 90744, United States",33.7985372,-118.2666529
First Church of the Nazarene - Pasadena,Wednesday 9am - 12pm,3700 E. Sierra Madre Boulevard,"Pasadena, CA 91107, United States","3700 E. Sierra Madre Boulevard Pasadena, CA 91107, United States",34.1602421,-118.0745907
First Lutheran Church of Inglewood,"Wednesday 10 am - 12 pm , Saturday 9 am - 12 pm",600 West Queen Street,"Inglewood, CA 90301, United States","600 West Queen Street Inglewood, CA 90301, United States",33.9624112,-118.3666276
First Missionary Baptist Church,2nd and 4th Thursday 11am - 12:30pm,37721 N. 100th Street E.,"Littlerock, CA 93543, United States","37721 N. 100th Street E. Littlerock, CA 93543, United States",34.5678245,-117.9526445
First New Christian Fellowship,Wednesday 2pm- 4pm; Thursday 9 - 11am,1555 W. 108th Street,"Los Angeles, CA 90047, United States","1555 W. 108th Street Los Angeles, CA 90047, United States",33.9383978,-118.304557
First Presbyterian Church,"1st & 3rd Saturday 9am-11am CLOSED November 15, OPEN November 22 1 pm - 3pm",1809 West Boulevard,"Los Angeles, CA 90019, United States","1809 West Boulevard Los Angeles, CA 90019, United States",34.0406344,-118.3372
First Southern Baptist Church of Hollywood,"Mondays 9:30am-while supplies last, Fridays 4pm-7pm (or while supplies last)",1528 N. Wilton Place,"Hollywood, CA 90028, United States","1528 N. Wilton Place Hollywood, CA 90028, United States",34.0991288,-118.3133707
First Unitarian Church,Saturday 7am - 9:30am,2936 W. 8th Street,"Los Angeles, CA 90005, United States","2936 W. 8th Street Los Angeles, CA 90005, United States",34.0573803,-118.2902094
First United Church of Reseda,Wednesday 1pm - 3pm,18120 Saticoy St,"Reseda, CA 91335, United States","18120 Saticoy St Reseda, CA 91335, United States",34.2080804,-118.5279552
First United Methodist Church of La Puente,2nd Tuesday 10am - 12:30 PM & Last Sunday 10am - 12:30 PM,15701 E. Hill Street,"La Puente, CA 91744, United States","15701 E. Hill Street La Puente, CA 91744, United States",34.026403,-117.9507813
First United Methodist Church of Montebello,1st and 3rd Saturday 12pm - 3pm,1220 W. Whittier Blvd,"Montebello, CA 90640, United States","1220 W. Whittier Blvd Montebello, CA 90640, United States",34.0117663,-118.1134715
FMBC-Helping Hands,Wednesday 10am-12pm,1300 E. 57th Street,"Los Angeles, CA 90011, United States","1300 E. 57th Street Los Angeles, CA 90011, United States",33.9908369,-118.2518864
Focus SoCal,2nd & 4th Saturday 10am-12pm Except in April will be the 1st & 4th,2300 W. 3rd St,"Los Angeles, CA 90057, United States","2300 W. 3rd St Los Angeles, CA 90057, United States",34.063654,-118.2751845
Food on Foot,Sunday's 1pm-3:45pm,1625 Schrader Blvd,"Los Angeles, CA 90028, United States","1625 Schrader Blvd Los Angeles, CA 90028, United States",34.1005519,-118.3327323
Foothill Unity Center,"Monday, Wednesday, Friday 9am-1130am",790 W. Chestnut Avenue,"Monrovia, CA 91016, United States","790 W. Chestnut Avenue Monrovia, CA 91016, United States",34.1422118,-118.0157726
Foothill Unity Center,"Tuesday, Wednesday, Friday 9 am - 11:30 am",191 N. Oak Avenue,"Pasadena, CA 91107, United States","191 N. Oak Avenue Pasadena, CA 91107, United States",34.1497175,-118.107833
For the Love of Our Veterans,Saturday 12pm-3pm & 4th Sunday 12pm-1pm,601 W Rosecrans,"Los Angeles, CA 90222, United States","601 W Rosecrans Los Angeles, CA 90222, United States",33.9035532,-118.234499
Freedom Church,Wednesday 9 am - 11 am,9200 Owensmouth Ave,"Chatsworth, CA 91311, United States","9200 Owensmouth Ave Chatsworth, CA 91311, United States",34.2372164,-118.6014079
Freedom of Spirit Church,1st & 3rd Friday 11:30am-1pm,6010 S. Broadway,"Los Angeles, CA 90003, United States","6010 S. Broadway Los Angeles, CA 90003, United States",33.9847268,-118.2780143
Fresh Anointing C.O.G.I.C.,Tuesday 10am-12pm,9020 Imperial Hwy,"Downey, CA 90242, United States","9020 Imperial Hwy Downey, CA 90242, United States",33.9167033,-118.1365212
Friends In Deed,"Tuesday, Wednesday 10 am - 3 pm & Thursday 10 am - 1 pm",444 E. Washing - n Boulevard,"Pasadena, CA 91104, United States","444 E. Washing - n Boulevard Pasadena, CA 91104, United States",34.1687084,-118.1413204
Gabrieleno-Tongva Tribal Council,1st & 3rd Friday 3 pm - 4 pm,203 E. Mission Rd,"San Gabriel, CA 91776, United States","203 E. Mission Rd San Gabriel, CA 91776, United States",34.0937662,-118.0981572
Gardena S.D.A. Church,1st & 3rd Saturday 12pm-3pm,16113 S. Denker Avenue,"Gardena, CA 90247, United States","16113 S. Denker Avenue Gardena, CA 90247, United States",33.8844806,-118.3047326
Gardena Valley Assembly of God,Sunday 12:30 pm - 1:30 pm,1473 W. 182nd Street,"Gardena, CA 90248, United States","1473 W. 182nd Street Gardena, CA 90248, United States",33.8660981,-118.3020668
Glassell Park S.D.A Church,3rd Saturday 2 pm - 4 pm,1500 N. Ave 53,"Los Angeles, CA 90042, United States","1500 N. Ave 53 Los Angeles, CA 90042, United States",34.1213034,-118.2000192
Glendale Central Spanish S.D.A. Church,"2nd, 4th Wednesday 3pm - 5pm",901 E. Broadway,"Glendale, CA 91205, United States","901 E. Broadway Glendale, CA 91205, United States",34.1465005,-118.243964
Glendale Community College - Garfield Campus,1st Friday 1pm-3pm,1122 E Garfield Ave,"Glendale, CA 91205, United States","1122 E Garfield Ave Glendale, CA 91205, United States",34.1357212,-118.2407844
Glendale Community College - Verdugo Campus,1st Wednesday 1pm-3pm,1500 N Verdugo Rd,"Glendale, CA 91208, United States","1500 N Verdugo Rd Glendale, CA 91208, United States",34.1673571,-118.2277571
God's Glorious Praise Ministries,Saturday 10am - 1pm,17808 Sierra Highway,"Canyon Country, CA 91387, United States","17808 Sierra Highway Canyon Country, CA 91387, United States",34.4267054,-118.4469448
God's Pantry,4th Saturday 8 am - 10 am,710 N. Lark Ellen Ave,"West Covina, CA 91791, United States","710 N. Lark Ellen Ave West Covina, CA 91791, United States",34.0836196,-117.9161736
Gods Divine Center Holiness Deliverance Church,2nd Friday 10am - 1pm,525 East 55th Street,"Long Beach, CA 90805, United States","525 East 55th Street Long Beach, CA 90805, United States",33.8563348,-118.185329
Gods Pantry,3rd Friday 9am-11am,1040 E. Gladstone St.,"Azusa, CA 91702, United States","1040 E. Gladstone St. Azusa, CA 91702, United States",34.11371,-117.8867828
Gods Pantry,Wednesday 1:00 pm - 3:30pm,250 East Center St,"Pomona, CA 91767, United States","250 East Center St Pomona, CA 91767, United States",34.0612469,-117.7468208
Good News Prayer Center,3rd Saturday 9 am - 12 pm,8010 Figueroa St.,"Los Angeles, CA 90003, United States","8010 Figueroa St. Los Angeles, CA 90003, United States",33.9664879,-118.2824536
Good Sam Pantry/Beatitudes of our Lord,Thursday 4:30 pm - 5:30 pm,13013 Santa Gertrudes Ave.,"La Mirada, CA 90638, United States","13013 Santa Gertrudes Ave. La Mirada, CA 90638, United States",33.9127709,-117.9947963
Good Shepherd Center (Catholic Charities of L.A.),Monday & Wednesday 9am-12pm,267 N Belmont Ave,"Los Angeles, CA 90026, United States","267 N Belmont Ave Los Angeles, CA 90026, United States",34.0666278,-118.2635801
Good Shepherd Lutheran Church,Sunday 8:30am-9:30am & 2nd & 4th Sunday 11am-12:30pm,1350 W. 25th St,"San Pedro, CA 90732, United States","1350 W. 25th St San Pedro, CA 90732, United States",33.7223884,-118.3069247
Gospel Mission Baptist Church,Wednesday 11 am - 12 pm & 6:15 pm - 6:45 pm,7301 S. Avalon Boulevard,"Los Angeles, CA 90003, United States","7301 S. Avalon Boulevard Los Angeles, CA 90003, United States",33.9735906,-118.2655068
Grace Evangelical Free Church of La Mirada,Friday 1pm - 5pm,12717 Santa Gertrudes Avenue,"La Mirada, CA 90638, United States","12717 Santa Gertrudes Avenue La Mirada, CA 90638, United States",33.9157395,-117.9953692
Grace Memorial,2nd & 4th Saturday 9am-10am,1021 E. 19th Street,"Long Beach, CA 90806, United States","1021 E. 19th Street Long Beach, CA 90806, United States",33.7913988,-118.1803542
"Grace Resource Center, Inc.","Tuesday, Wednesday & Thursday Walk Ups 10:15am - 12pm & Drive Through Tuesday & Thursday  1pm -3pm",45134 N. Sierra Hwy.,"Lancaster, CA 93534, United States","45134 N. Sierra Hwy. Lancaster, CA 93534, United States",34.7027136,-118.1373205
Grant AME Church,Thursday 9 am - 11 am,1147 E. 105th Street.,"Los Angeles, CA 90002, United States","1147 E. 105th Street. Los Angeles, CA 90002, United States",33.9411661,-118.2549668
Greater Emmanuel M.B.C.,Friday 10 AM- 12 PM,3727 W. 111th Pl,"Inglewood, CA 90303, United States","3727 W. 111th Pl Inglewood, CA 90303, United States",33.9340779,-118.3384248
Greater Emmanuel M.B.C.,Wednesday 10:30 am - 12:30 pm,9239 S. Vermont Ave,"Los Angeles, CA 90004, United States","9239 S. Vermont Ave Los Angeles, CA 90004, United States",33.9524146,-118.292122
Greater Good News Church of God in Christ,2nd & 4th Sunday 10am-11am,5840 S. Broadway,"Los Angeles, CA 90003, United States","5840 S. Broadway Los Angeles, CA 90003, United States",33.9884911,-118.2780143
"Greater New Bethel Baptist Church, Inc.","2nd Tuesday, 4th Thursday 10 am - 1 pm",601 E. 99th Street,"Inglewood, CA 90301, United States","601 E. 99th Street Inglewood, CA 90301, United States",33.9469064,-118.3464231
Greater New Light Baptist Church,Tuesday 10:30am-11:30am,1734 Arroyo Ave,"Pomona, CA 91768, United States","1734 Arroyo Ave Pomona, CA 91768, United States",34.0652382,-117.7830802
Greater New Morning Star Baptist Church,Saturday 8:30am-12pm,210 W. Florence Avenue,"Los Angeles, CA 90003, United States","210 W. Florence Avenue Los Angeles, CA 90003, United States",33.9743353,-118.276644
Guadalupe Food Program,2nd & 4th Wednesday 3:30pm-5:30pm,4018 Hammel St,"Los Angeles, CA 90063, United States","4018 Hammel St Los Angeles, CA 90063, United States",34.042133,-118.1794993
H.O.P.E. Helping Other People Excel,Tuesday 10am - 12pm,7615 S. Western Ave,"Los Angeles, CA 90047, United States","7615 S. Western Ave Los Angeles, CA 90047, United States",33.9703952,-118.3092688
Hacienda Christian Fellowship,2nd & 4th  Friday 2pm-4pm,1358 N Hacienda Blvd,"La Puente, CA 91744, United States","1358 N Hacienda Blvd La Puente, CA 91744, United States",34.0453776,-117.9487438
"Harbor Christian Center, Inc.","4th Tuesday , 4th Thursday & 4th Saturday 10:30am-12pm & 12:45pm-1:30pm",1602 N. Wilmington Blvd.,"Wilmington, CA 90744, United States","1602 N. Wilmington Blvd. Wilmington, CA 90744, United States",33.7949509,-118.2748981
Harbor Interfaith Services,Monday - Friday 9:00 AM - 5:00 PM,670 W. 9th St,"San Pedro, CA 90732, United States","670 W. 9th St San Pedro, CA 90732, United States",33.7363011,-118.2916572
Hawaiian Gardens Food Bank,"Tuesday, Thursday 10am -3 PM, Wednesday 10am-5pm",22121 Norwalk Blvd.,"Hawaiian Gardens, CA 90716, United States","22121 Norwalk Blvd. Hawaiian Gardens, CA 90716, United States",33.8270963,-118.0721441
Hawaiin Fedde Sports Complex,11/26/2025 | 9am - 12pm,21301 Elaine Avenue,"Hawaiian Gardens, CA 90716, United States","21301 Elaine Avenue Hawaiian Gardens, CA 90716, United States",33.8357383,-118.076834
Hawthorne S.D.A. Church,1st and 3rd Sunday 10am - 12pm,3939 Marine Ave,"Hawthorne, CA 90250, United States","3939 Marine Ave Hawthorne, CA 90250, United States",33.8951513,-118.3429262
Hays Tabernacle C.M.E. Church,2nd & 4th Tuesday  10:00 am - 2:00 pm,10121 S. Central Ave.,"Los Angeles, CA 90002, United States","10121 S. Central Ave. Los Angeles, CA 90002, United States",33.9442971,-118.2544439
Healing & Hope 4 Homeless,1st and 3rd Saturday 7am-9am,1327 W 64th St,"Los Angeles, CA 90044, United States","1327 W 64th St Los Angeles, CA 90044, United States",33.9816326,-118.2990537
"Healing Los Angeles Together, Inc.","Wednesday 12pm-2pm & 1st ,3rd & 5th  Saturday 12pm-2pm",11001 Crenshaw Blvd,"Inglewood, CA 90303, United States","11001 Crenshaw Blvd Inglewood, CA 90303, United States",33.9356739,-118.3268671
Heavenly Hope House of Prayer,Friday 10 am-1:45 pm,3650 Western Ave,"Los Angeles, CA 90016, United States","3650 Western Ave Los Angeles, CA 90016, United States",34.0217824,-118.3087288
Help Me Help You,1st wedensday 2pm-3pm,730 W 3rd Street,"Long Beach, CA 90802, United States","730 W 3rd Street Long Beach, CA 90802, United States",33.7696911,-118.2011245
Help Me Help You,2nd & 4th wedensday 11:15am-12:15pm,1175 E 11th Street,"Long Beach, CA 90813, United States","1175 E 11th Street Long Beach, CA 90813, United States",33.7812116,-118.1770636
Help Me Help You,2nd and 4th Friday 2pm-3pm,6822 Paramount Blvd.,"Lakewood, CA 90805, United States","6822 Paramount Blvd. Lakewood, CA 90805, United States",33.8786599,-118.1585302
Help Me Help You,1st & 3rd Wednesday 4pm-5pm,628 Alamitos Ave.,"Long Beach, CA 90802, United States","628 Alamitos Ave. Long Beach, CA 90802, United States",33.7745062,-118.1797372
Help Me Help You,2nd and 4th Wednesdays 1pm - 2pm,2640 Santa Fe Ave,"Long Beach, CA 90810, United States","2640 Santa Fe Ave Long Beach, CA 90810, United States",33.805261,-118.2150894
Help Me Help You,1st annd3rd Friday 1pm-2pm,668 Obispo Ave,"Long Beach, CA 90814, United States","668 Obispo Ave Long Beach, CA 90814, United States",33.7747794,-118.1541576
Help Me Help You,2nd and 4th Friday 11:30am - 12:30pm,700 Locust Ave,"Long Beach, CA 90813, United States","700 Locust Ave Long Beach, CA 90813, United States",33.775536,-118.1906597
Help Me Help You,3rd Wednesday 11:30am - 12:30pm,1716 Walnut Ave,"Long Beach, CA 90813, United States","1716 Walnut Ave Long Beach, CA 90813, United States",33.7884002,-118.1718121
Help Me Help You,1st and 3rd Friday 11:30am - 12:30 pm,515 Lime Ave,"Long Beach, CA 90802, United States","515 Lime Ave Long Beach, CA 90802, United States",33.7738309,-118.184025
"Helping Hands, Caring Hearts Ministry",Saturday 9 am - 12 pm,500 Vinton Ave,"Pomona, CA 91767, United States","500 Vinton Ave Pomona, CA 91767, United States",34.0781626,-117.7440486
Higher Vision Church,Saturday 9am-11am,27053 Hanby Ave,"Canyon Country, CA 91351, United States","27053 Hanby Ave Canyon Country, CA 91351, United States",34.4250713,-118.4943473
Higher Vision Church,Wednesday 10am-11:30am & Saturday 9am-11am,28776 The Old Road,"Valencia, CA 91355, United States","28776 The Old Road Valencia, CA 91355, United States",34.4415195,-118.6046902
His Helping Hands,Thurday 6pm - 7pm,25501 Oak Street,"Lomita, CA 90717, United States","25501 Oak Street Lomita, CA 90717, United States",33.7920015,-118.3177934
HJ New Day New Way Recovery Inc.,3rd Thurs 12:30pm-3pm 1st & 2nd Sunday 11:30 am- 1 pm,8722 Crenshaw Blvd,"Inglewood, CA 90303, United States","8722 Crenshaw Blvd Inglewood, CA 90303, United States",33.9583271,-118.3261224
Hollydale Regional Park MFP,1st Wednesday 9am-11am,5400 Monroe Ave,"South Gate, CA 90280, United States","5400 Monroe Ave South Gate, CA 90280, United States",33.9201877,-118.1747328
Hollywood Community Housing,"Thursday 3pm - 5pm, CLOSED 11/27, 12/25, 1/1",5020 W. Santa Monica Boulevard,"Los Angeles, CA 90029, United States","5020 W. Santa Monica Boulevard Los Angeles, CA 90029, United States",34.0904399,-118.2987956
Hollywood Lutheran Church,Wednesday 11am - 1 PM,1733 N. New Hampshire Ave.,"Hollywood, CA 90027, United States","1733 N. New Hampshire Ave. Hollywood, CA 90027, United States",34.1028083,-118.2936503
Holy Cross Center MFP,3rd Tuesday 9am-11am,104 W. 47th Place,"Los Angeles, CA 90037, United States","104 W. 47th Place Los Angeles, CA 90037, United States",33.9997047,-118.2743145
Holy Family Giving Bank,Monday 9 am - 10:45 am,1524 Fremont Avenue,"South Pasadena, CA 91030, United States","1524 Fremont Avenue South Pasadena, CA 91030, United States",34.1080226,-118.1526561
Holy Redeemer Lutheran Church,Friday 9am-10am,14515 Blaine Ave,"Bellflower, CA 90706, United States","14515 Blaine Ave Bellflower, CA 90706, United States",33.9006004,-118.1271947
Holy Trinity Lutheran Church,2nd & 4th Saturday 12 pm - 1 pm,9300 Crenshaw Blvd,"Inglewood, CA 90305, United States","9300 Crenshaw Blvd Inglewood, CA 90305, United States",33.9521226,-118.3260668
Holy Virgin Mary Coptic Orthodox Church,3rd Wednesday 9 AM - 10 AM,4900 Cleland Avenue,"Los Angeles, CA 90042, United States","4900 Cleland Avenue Los Angeles, CA 90042, United States",34.1142932,-118.2104038
Hope & Cure Fibromyalgia Foundation Corporation,1st & 4th Saturday 10 am - 12pm,2426 Santa Fe Ave,"Long Beach, CA 90810, United States","2426 Santa Fe Ave Long Beach, CA 90810, United States",33.8013833,-118.2151493
Hope Chapel Foursquare Church,Wednesday & Friday 9am - 12pm &  1pm - 4pm,2420 Pacific Coast Highway,"Hermosa Beach, CA 90254, United States","2420 Pacific Coast Highway Hermosa Beach, CA 90254, United States",33.8715255,-118.394311
Hope Chapel Lancaster,"1st, 3rd Friday 930am - 11am",6015 W Avenue J8,"Quartz Hill, CA 93536, United States","6015 W Avenue J8 Quartz Hill, CA 93536, United States",34.682475,-118.2376777
Hope Chapel Lancaster - Mayflower Gardens,3rd Friday 12pm-1pm,6570 W Avenue L12,"Quartz Hill, CA 93536, United States","6570 W Avenue L12 Quartz Hill, CA 93536, United States",34.6492887,-118.2470194
Hopes & Promises,Thursday 4pm - 6pm,7106 Sorensen Ave,"Whittier, CA 90606, United States","7106 Sorensen Ave Whittier, CA 90606, United States",33.9769726,-118.0536181
House of Food and Prayer,Saturday 9am-12pm,805 N. 1st Ave,"Duarte, CA 91010, United States","805 N. 1st Ave Duarte, CA 91010, United States",34.1484839,-118.0289284
Houses of Light Church Corporation,Saturdays 6:30am - 7:30am,19359 Londelius Street,"Northridge, CA 91324, United States","19359 Londelius Street Northridge, CA 91324, United States",34.2304407,-118.5557711
ICNA Relief,3rd  Tuesday 4:10 pm  - 6 pm,1301 E Las Tunas Dr,"San Gabriel, CA 91776, United States","1301 E Las Tunas Dr San Gabriel, CA 91776, United States",34.1040544,-118.0793696
ICNA Relief,1st Tuesdays 2:45 pm - 4 pm,805 S. Garey Ave,"Pomona, CA 91766, United States","805 S. Garey Ave Pomona, CA 91766, United States",34.0521784,-117.7503192
ICNA Relief,3rd Thursday 2:30 pm-4:30 pm,18206 Victory Blvd,"Tarzana, CA 91335, United States","18206 Victory Blvd Tarzana, CA 91335, United States",34.1862531,-118.5297453
ICNA Relief,2nd & 4th Tuesday 2:30 pm - 3:30 pm,12209 Hawthorne Way,"Hawthorne, CA 90250, United States","12209 Hawthorne Way Hawthorne, CA 90250, United States",33.9217506,-118.353865
ICNA Relief USA Program,Tuesday 11 am-1 pm,19164 E. Walnut Drive,"Rowland Heights, CA 91748, United States","19164 E. Walnut Drive Rowland Heights, CA 91748, United States",33.9953969,-117.8843317
Iglesia Cristiana El Shaddai USA,Friday  10am-12pm & Friday  9am-10am  CLOSED  11/7 &  December 2025,5518 S. Broadway,"Los Angeles, CA 90037, United States","5518 S. Broadway Los Angeles, CA 90037, United States",33.9921093,-118.2780381
Iglesia de Cristo Elim,Saturday 7am - 9am,550 S. Hollenbeck Ave.,"Covina, CA 91723, United States","550 S. Hollenbeck Ave. Covina, CA 91723, United States",34.0800083,-117.8986051
Iglesia de la Comunidad Presbyterian Church,1st & 3rd Thursday 10:30am - 12:30pm,115 N. Ave 53,"Los Angeles, CA 90042, United States","115 N. Ave 53 Los Angeles, CA 90042, United States",34.1073413,-118.1981542
Iglesia Macedonia Defenders of the Christian Faith,"Wednesday 6 am - 7:30 am, Thursday 8:30 am - 9:30 am & Saturday 1:30 pm - 2:30 pm",9228 S. Central Ave,"Los Angeles, CA 90002, United States","9228 S. Central Ave Los Angeles, CA 90002, United States",33.9525626,-118.2557459
